{
  "schema_version": "1.0.0",
  "metadata": {
    "student_name": "Example Student",
    "student_id": "EXAMPLE-001",
    "group_id": "GROUP-DEMO",
    "submitted_at": "2026-08-24T09:00:00+07:00"
  },
  "industry": "hr-recruitment",
  "product_context": {
    "product_name": "Tutor Candidate Review Assistant",
    "product_stage": "pilot",
    "problem_statement": "Recruiters spend too much time triaging high-volume applications and may apply criteria inconsistently.",
    "target_users": ["recruiters", "hiring managers"],
    "value_hypothesis": "Decision support can shorten qualified-candidate review time without reducing access or recruiter accountability.",
    "in_scope": ["surface evidence", "recommend review order", "flag missing application data"],
    "non_goals": ["automatic rejection", "final hiring decision", "personality inference"],
    "user_journey_moment": "After application completeness check and before recruiter shortlist review",
    "target_launch_or_review_date": "2026-10-01",
    "automation_level": "recommendation",
    "fallback_experience": "Recruiters use the standard chronological review queue when the assistant is unavailable or paused.",
    "decision_reversibility": "partially-reversible"
  },
  "system_profile": {
    "purpose": "Screen applications and recommend a shortlist for an entry-level tutoring role.",
    "user_groups": ["recruiters", "hiring managers"],
    "decision_impact": "The recommendation influences access to employment but does not make the final hiring decision.",
    "data_types": ["resume data", "application answers", "assessment scores"],
    "deployment_context": "A private employer uses a vendor-hosted screening workflow for remote applicants.",
    "target_markets": ["Vietnam", "European Union"],
    "system_boundary": {
      "model": "ranking model and deterministic eligibility rules",
      "application": "candidate portal and recruiter review dashboard",
      "people": ["applicants", "recruiters", "hiring managers", "appeal reviewer"],
      "vendors": ["screening platform provider", "assessment provider"],
      "upstream_inputs": ["job criteria", "candidate applications", "historical selection data"],
      "downstream_decisions": ["reject", "request human review", "advance to interview"]
    }
  },
  "industry_risk_snapshot": {
    "harm_severity": 4,
    "high_stakes": 4,
    "sensitive_data": 3,
    "affected_scale": 4,
    "human_review_need": 5,
    "rationale": "Employment access affects income and dignity. Screening can operate at high scale, reproduce protected-group disparities, and hide errors from applicants, so meaningful review and appeal are essential."
  },
  "legal_classification": {
    "vietnam": {
      "status": "uncertain-requires-legal-review",
      "rationale": "The exact function and market facts must be checked against the AI Law, implementing decree, and current high-risk list before deployment.",
      "source_ids": ["SRC-04", "SRC-05"]
    },
    "eu": {
      "status": "high-risk",
      "rationale": "Employment-related AI is an Annex III high-risk area, while the applicable obligation date and provider/deployer role still require current legal review.",
      "source_ids": ["SRC-06"]
    },
    "other_markets": "United States employment discrimination rules require separate counsel review.",
    "legal_review_required": true
  },
  "product_metrics": {
    "success_kpi": "Median time from complete application to first qualified recruiter review is at most two business days.",
    "risk_kri": "Qualified-candidate recall gap between monitored groups remains at or below five percentage points.",
    "guardrail_metric": "Automatic rejection count remains exactly zero in every production reporting period.",
    "review_cadence": "Monthly and before any material change to data criteria vendor model workflow or target market."
  },
  "release_decision": {
    "accountable_product_owner": "Talent Product Owner",
    "risk_acceptance_owner": "Head of Talent Acquisition",
    "independent_reviewer": "Responsible AI Review Board",
    "decision": "conditional-go",
    "release_blockers": ["GAP-01: Vietnam classification review not yet signed", "GAP-02: EU launch evidence not yet independently verified"],
    "release_conditions": ["zero automatic rejection paths", "signed launch evidence pack", "named on-call escalation owner"],
    "next_review_trigger": "Review on any threshold breach incident vendor change new target market or 2026-10-31 whichever comes first.",
    "residual_risk_rationale": "Use is limited to recommendations; automatic rejection is disabled, appeal is available, and deployment stops if disparity or override thresholds are breached."
  }
}
