{
  "schema_version": "1.0.0",
  "metadata": {
    "student_name": "Lê Minh Khiêm",
    "student_id": "2A202601645",
    "group_id": "GROUP-KHIEM-TUYET",
    "submitted_at": "2026-08-24T15:00:00+07:00"
  },
  "industry": "hr-recruitment",
  "product_context": {
    "product_name": "FairScreen VN",
    "product_stage": "pilot",
    "problem_statement": "Nhân viên tuyển dụng mất nhiều thời gian đọc hồ sơ thực tập sinh số lượng lớn và có thể áp dụng tiêu chí không nhất quán.",
    "target_users": ["nhân viên tuyển dụng", "quản lý tuyển dụng"],
    "value_hypothesis": "Trợ lý xếp thứ tự hồ sơ sẽ rút ngắn thời gian đưa ứng viên đủ điều kiện tới bước đánh giá của con người mà không làm giảm cơ hội tiếp cận công bằng.",
    "in_scope": ["kiểm tra tính đầy đủ của hồ sơ", "trích xuất bằng chứng liên quan tiêu chí công việc", "đề xuất thứ tự ưu tiên để con người đánh giá"],
    "non_goals": ["tự động loại ứng viên", "đưa ra quyết định tuyển dụng cuối cùng", "suy luận tính cách hoặc thuộc tính nhạy cảm"],
    "user_journey_moment": "Sau khi ứng viên nộp đủ hồ sơ và trước khi nhân viên tuyển dụng lập danh sách phỏng vấn",
    "target_launch_or_review_date": "2026-10-15",
    "automation_level": "recommendation",
    "fallback_experience": "Khi hệ thống bị tạm dừng hoặc không an toàn, nhân viên tuyển dụng quay về hàng đợi theo thời điểm nộp và đánh giá thủ công bằng rubric đã phê duyệt.",
    "decision_reversibility": "partially-reversible"
  },
  "system_profile": {
    "purpose": "Hỗ trợ sàng lọc và đề xuất thứ tự đọc hồ sơ cho chương trình tuyển thực tập sinh tại Việt Nam.",
    "user_groups": ["nhân viên tuyển dụng", "quản lý tuyển dụng"],
    "decision_impact": "Khuyến nghị ảnh hưởng cơ hội được con người xem xét và mời phỏng vấn nhưng không được phép tự động loại hoặc tuyển ứng viên.",
    "data_types": ["thông tin hồ sơ ứng tuyển", "kinh nghiệm và kỹ năng", "câu trả lời biểu mẫu", "điểm đánh giá công việc"],
    "deployment_context": "Ứng dụng nội bộ kết nối cổng ứng viên và hệ thống quản lý tuyển dụng của một doanh nghiệp hoạt động tại Việt Nam.",
    "target_markets": ["Vietnam", "European Union in a later phase"],
    "system_boundary": {
      "model": "mô hình xếp hạng kết hợp quy tắc kiểm tra tính đầy đủ",
      "application": "cổng ứng viên và bảng điều khiển đánh giá của recruiter",
      "people": ["ứng viên", "nhân viên tuyển dụng", "quản lý tuyển dụng", "người xử lý khiếu nại", "nhóm compliance"],
      "vendors": ["nhà cung cấp nền tảng tuyển dụng", "nhà cung cấp dịch vụ mô hình"],
      "upstream_inputs": ["mô tả công việc", "rubric năng lực", "hồ sơ ứng viên", "dữ liệu tuyển dụng lịch sử đã được phê duyệt"],
      "downstream_decisions": ["đưa vào hàng đợi review", "yêu cầu bổ sung thông tin", "mời phỏng vấn", "không tiến tới vòng sau sau human review"]
    }
  },
  "industry_risk_snapshot": {
    "harm_severity": 4,
    "high_stakes": 4,
    "sensitive_data": 4,
    "affected_scale": 4,
    "human_review_need": 5,
    "rationale": "Quyền tiếp cận việc làm ảnh hưởng thu nhập, cơ hội nghề nghiệp và phẩm giá. Hồ sơ có dữ liệu cá nhân, hệ thống có thể xử lý số lượng lớn và tái tạo chênh lệch lịch sử mà ứng viên khó phát hiện; vì vậy mọi quyết định bất lợi cần review có ý nghĩa, giải thích và đường khiếu nại."
  },
  "legal_classification": {
    "vietnam": {
      "status": "uncertain-requires-legal-review",
      "rationale": "Workflow cụ thể, vai trò của doanh nghiệp và danh mục AI rủi ro cao hiện hành phải được đối chiếu bằng legal memo trước pilot; không suy ra phân loại pháp lý chỉ từ risk score.",
      "source_ids": ["SRC-05", "SRC-06"]
    },
    "eu": {
      "status": "high-risk",
      "rationale": "AI dùng trong tuyển dụng thuộc nhóm employment high-risk, nhưng vai trò provider/deployer và mốc áp dụng nghĩa vụ cần được legal review lại trước khi mở thị trường EU.",
      "source_ids": ["SRC-07"]
    },
    "other_markets": "Hoa Kỳ chưa nằm trong pilot nhưng các nghĩa vụ chống phân biệt đối xử cần được đánh giá riêng nếu mở rộng.",
    "legal_review_required": true
  },
  "product_metrics": {
    "success_kpi": "Ít nhất 90% hồ sơ đầy đủ được một recruiter đánh giá lần đầu trong vòng hai ngày làm việc.",
    "risk_kri": "Chênh lệch qualified-candidate recall giữa các nhóm được giám sát không vượt quá 5 điểm phần trăm mỗi tháng.",
    "guardrail_metric": "Số quyết định loại ứng viên được thực hiện hoàn toàn tự động phải luôn bằng 0 trong mọi kỳ báo cáo.",
    "review_cadence": "Review hàng tuần trong pilot, hàng tháng sau pilot và ngay khi có incident, threshold breach, thay vendor, dữ liệu, scope hoặc thị trường."
  },
  "release_decision": {
    "accountable_product_owner": "Talent Product Owner",
    "risk_acceptance_owner": "Head of Talent Acquisition",
    "independent_reviewer": "Responsible AI and Legal Review Board",
    "decision": "conditional-go",
    "release_blockers": ["GAP-01: chưa có legal và privacy classification memo được ký", "GAP-02: chưa hoàn tất independent subgroup evaluation", "GAP-03: chưa diễn tập human review và appeal workflow"],
    "release_conditions": ["không tồn tại đường tự động loại ứng viên", "ba release blocker phải chuyển sang done", "pilot giới hạn 500 hồ sơ và có on-call owner"],
    "next_review_trigger": "Review ngày 2026-10-15 hoặc sớm hơn khi có incident, chênh lệch recall vượt 5 điểm phần trăm, vendor/data/scope/market thay đổi.",
    "residual_risk_rationale": "Pilot chỉ được bắt đầu sau khi các blocker đóng; recommendation không thay quyết định con người, ứng viên có kênh khiếu nại và hệ thống bị dừng khi vi phạm guardrail."
  }
}
